id,ParagraphNum,PlainText,character_id,chapter_id
631089,525,"Have you any commission from your lord to negotiate
with my face? You are now out of your text: but
we will draw the curtain and show you the picture.
Look you, sir, such a one I was this present: is't
not well done?",836,18708
631090,530,[Unveiling],1261,18708
631091,531,"Excellently done, if God did all.",1238,18708
631092,532,"'Tis in grain, sir; 'twill endure wind and weather.",836,18708
631093,533,"'Tis beauty truly blent, whose red and white
Nature's own sweet and cunning hand laid on:
Lady, you are the cruell'st she alive,
If you will lead these graces to the grave
And leave the world no copy.",1238,18708
631094,538,"O, sir, I will not be so hard-hearted; I will give
out divers schedules of my beauty: it shall be
inventoried, and every particle and utensil
labelled to my will: as, item, two lips,
indifferent red; item, two grey eyes, with lids to
them; item, one neck, one chin, and so forth. Were
you sent hither to praise me?",836,18708
631095,545,"I see you what you are, you are too proud;
But, if you were the devil, you are fair.
My lord and master loves you: O, such love
Could be but recompensed, though you were crown'd
The nonpareil of beauty!",1238,18708
631096,550,"How does he love me?",836,18708
631097,551,"With adorations, fertile tears,
With groans that thunder love, with sighs of fire.",1238,18708
631098,553,"Your lord does know my mind; I cannot love him:
Yet I suppose him virtuous, know him noble,
Of great estate, of fresh and stainless youth;
In voices well divulged, free, learn'd and valiant;
And in dimension and the shape of nature
A gracious person: but yet I cannot love him;
He might have took his answer long ago.",836,18708
631099,560,"If I did love you in my master's flame,
With such a suffering, such a deadly life,
In your denial I would find no sense;
I would not understand it.",1238,18708
631100,564,"Why, what would you?",836,18708
631101,565,"Make me a willow cabin at your gate,
And call upon my soul within the house;
Write loyal cantons of contemned love
And sing them loud even in the dead of night;
Halloo your name to the reverberate hills
And make the babbling gossip of the air
Cry out 'Olivia!' O, You should not rest
Between the elements of air and earth,
But you should pity me!",1238,18708
631102,574,"You might do much.
What is your parentage?",836,18708
631103,576,"Above my fortunes, yet my state is well:
I am a gentleman.",1238,18708
631104,578,"Get you to your lord;
I cannot love him: let him send no more;
Unless, perchance, you come to me again,
To tell me how he takes it. Fare you well:
I thank you for your pains: spend this for me.",836,18708
631105,583,"I am no fee'd post, lady; keep your purse:
My master, not myself, lacks recompense.
Love make his heart of flint that you shall love;
And let your fervor, like my master's, be
Placed in contempt! Farewell, fair cruelty.",1238,18708
631106,588,[Exit],1261,18708
631107,589,"'What is your parentage?'
'Above my fortunes, yet my state is well:
I am a gentleman.' I'll be sworn thou art;
Thy tongue, thy face, thy limbs, actions and spirit,
Do give thee five-fold blazon: not too fast:
soft, soft!
Unless the master were the man. How now!
Even so quickly may one catch the plague?
Methinks I feel this youth's perfections
With an invisible and subtle stealth
To creep in at mine eyes. Well, let it be.
What ho, Malvolio!",836,18708
631108,601,"[Re-enter MALVOLIO]",1261,18708
631109,602,"Here, madam, at your service.",728,18708
631110,603,"Run after that same peevish messenger,
The county's man: he left this ring behind him,
Would I or not: tell him I'll none of it.
Desire him not to flatter with his lord,
Nor hold him up with hopes; I am not for him:
If that the youth will come this way to-morrow,
I'll give him reasons for't: hie thee, Malvolio.",836,18708
631111,610,"Madam, I will.",728,18708
631112,611,[Exit],1261,18708
631113,612,"I do I know not what, and fear to find
Mine eye too great a flatterer for my mind.
Fate, show thy force: ourselves we do not owe;
What is decreed must be, and be this so.",836,18708
631114,616,[Exit],1261,18708
631115,619,"[Enter ANTONIO and SEBASTIAN]",1261,18709
631116,620,"Will you stay no longer? nor will you not that I go with you?",116,18709
631117,621,"By your patience, no. My stars shine darkly over
me: the malignancy of my fate might perhaps
distemper yours; therefore I shall crave of you your
leave that I may bear my evils alone: it were a bad
recompense for your love, to lay any of them on you.",976,18709
631118,627,"No, sooth, sir: my determinate voyage is mere
extravagancy. But I perceive in you so excellent a
touch of modesty, that you will not extort from me
what I am willing to keep in; therefore it charges
me in manners the rather to express myself. You
must know of me then, Antonio, my name is Sebastian,
which I called Roderigo. My father was that
Sebastian of Messaline, whom I know you have heard
of. He left behind him myself and a sister, both
born in an hour: if the heavens had been pleased,
would we had so ended! but you, sir, altered that;
for some hour before you took me from the breach of
the sea was my sister drowned.",976,18709
631119,640,"Alas the day!",116,18709
631120,641,"A lady, sir, though it was said she much resembled
me, was yet of many accounted beautiful: but,
though I could not with such estimable wonder
overfar believe that, yet thus far I will boldly
publish her; she bore a mind that envy could not but
call fair. She is drowned already, sir, with salt
water, though I seem to drown her remembrance again with more.",976,18709
631121,648,"Pardon me, sir, your bad entertainment.",116,18709
631122,649,"O good Antonio, forgive me your trouble.",976,18709
631123,650,"If you will not murder me for my love, let me be
your servant.",116,18709
631124,652,"If you will not undo what you have done, that is,
kill him whom you have recovered, desire it not.
Fare ye well at once: my bosom is full of kindness,
and I am yet so near the manners of my mother, that
upon the least occasion more mine eyes will tell
tales of me. I am bound to the Count Orsino's court: farewell.",976,18709
631125,658,[Exit],1261,18709
631126,659,"The gentleness of all the gods go with thee!
I have many enemies in Orsino's court,
Else would I very shortly see thee there.
But, come what may, I do adore thee so,
That danger shall seem sport, and I will go.",116,18709
631127,664,[Exit],1261,18709
631128,666,"[Enter VIOLA, MALVOLIO following]",1261,18710
631129,667,"Were not you even now with the Countess Olivia?",728,18710
631130,668,"Even now, sir; on a moderate pace I have since
arrived but hither.",1238,18710
631131,670,"She returns this ring to you, sir: you might have
saved me my pains, to have taken it away yourself.
She adds, moreover, that you should put your lord
into a desperate assurance she will none of him:
and one thing more, that you be never so hardy to
come again in his affairs, unless it be to report
your lord's taking of this. Receive it so.",728,18710
631132,677,"She took the ring of me: I'll none of it.",1238,18710
631133,678,"Come, sir, you peevishly threw it to her; and her
will is, it should be so returned: if it be worth
stooping for, there it lies in your eye; if not, be
it his that finds it.",728,18710
631134,682,[Exit],1261,18710
631135,683,"I left no ring with her: what means this lady?
Fortune forbid my outside have not charm'd her!
She made good view of me; indeed, so much,
That sure methought her eyes had lost her tongue,
For she did speak in starts distractedly.
She loves me, sure; the cunning of her passion
Invites me in this churlish messenger.
None of my lord's ring! why, he sent her none.
I am the man: if it be so, as 'tis,
Poor lady, she were better love a dream.
Disguise, I see, thou art a wickedness,
Wherein the pregnant enemy does much.
How easy is it for the proper-false
In women's waxen hearts to set their forms!
Alas, our frailty is the cause, not we!
For such as we are made of, such we be.
How will this fadge? my master loves her dearly;
And I, poor monster, fond as much on him;
And she, mistaken, seems to dote on me.
What will become of this? As I am man,
My state is desperate for my master's love;
As I am woman,--now alas the day!--
What thriftless sighs shall poor Olivia breathe!
O time! thou must untangle this, not I;
It is too hard a knot for me to untie!",1238,18710
631136,708,[Exit],1261,18710
631137,710,"[Enter SIR TOBY BELCH and SIR ANDREW]",1261,18711
631138,711,"Approach, Sir Andrew: not to be abed after
midnight is to be up betimes; and 'diluculo
surgere,' thou know'st,--",159,18711
631139,714,"Nay, my troth, I know not: but I know, to be up
late is to be up late.",60,18711
631140,716,"A false conclusion: I hate it as an unfilled can.
To be up after midnight and to go to bed then, is
early: so that to go to bed after midnight is to go
to bed betimes. Does not our life consist of the
four elements?",159,18711
631141,721,"Faith, so they say; but I think it rather consists
of eating and drinking.",60,18711
631142,723,"Thou'rt a scholar; let us therefore eat and drink.
Marian, I say! a stoup of wine!",159,18711
631143,725,"[Enter Clown]",1261,18711
631144,726,"Here comes the fool, i' faith.",60,18711
631145,727,"How now, my hearts! did you never see the picture
of 'we three'?",401,18711
631146,729,"Welcome, ass. Now let's have a catch.",159,18711
631147,730,"By my troth, the fool has an excellent breast. I
had rather than forty shillings I had such a leg,
and so sweet a breath to sing, as the fool has. In
sooth, thou wast in very gracious fooling last
night, when thou spokest of Pigrogromitus, of the
Vapians passing the equinoctial of Queubus: 'twas
very good, i' faith. I sent thee sixpence for thy
leman: hadst it?",60,18711
631148,738,"I did impeticos thy gratillity; for Malvolio's nose
is no whipstock: my lady has a white hand, and the
Myrmidons are no bottle-ale houses.",401,18711
631149,741,"Excellent! why, this is the best fooling, when all
is done. Now, a song.",60,18711
631150,743,"Come on; there is sixpence for you: let's have a song.",159,18711
631151,744,"There's a testril of me too: if one knight give a--",60,18711
631152,745,"Would you have a love-song, or a song of good life?",401,18711
631153,746,"A love-song, a love-song.",159,18711
631154,747,"Ay, ay: I care not for good life.",60,18711
631155,748,"[Sings]
O mistress mine, where are you roaming?
O, stay and hear; your true love's coming,
That can sing both high and low:
Trip no further, pretty sweeting;
Journeys end in lovers meeting,
Every wise man's son doth know.",401,18711
631156,755,"Excellent good, i' faith.",60,18711
631157,756,"Good, good.",159,18711
631158,757,"[Sings]
What is love? 'tis not hereafter;
Present mirth hath present laughter;
What's to come is still unsure:
In delay there lies no plenty;
Then come kiss me, sweet and twenty,
Youth's a stuff will not endure.",401,18711
631159,764,"A mellifluous voice, as I am true knight.",60,18711
631160,765,"A contagious breath.",159,18711
631161,766,"Very sweet and contagious, i' faith.",60,18711
631162,767,"To hear by the nose, it is dulcet in contagion.
But shall we make the welkin dance indeed? shall we
rouse the night-owl in a catch that will draw three
souls out of one weaver? shall we do that?",159,18711
631163,771,"An you love me, let's do't: I am dog at a catch.",60,18711
631164,772,"By'r lady, sir, and some dogs will catch well.",401,18711
631165,773,"Most certain. Let our catch be, 'Thou knave.'",60,18711
631166,774,"'Hold thy peace, thou knave,' knight? I shall be
constrained in't to call thee knave, knight.",401,18711
631167,776,"'Tis not the first time I have constrained one to
call me knave. Begin, fool: it begins 'Hold thy peace.'",60,18711
631168,778,"I shall never begin if I hold my peace.",401,18711
631169,779,"Good, i' faith. Come, begin.",60,18711
631170,780,"[Catch sung]",1261,18711
631171,781,"[Enter MARIA]",1261,18711
631172,782,"What a caterwauling do you keep here! If my lady
have not called up her steward Malvolio and bid him
turn you out of doors, never trust me.",738,18711
631173,785,"My lady's a Cataian, we are politicians, Malvolio's
a Peg-a-Ramsey, and 'Three merry men be we.' Am not
I consanguineous? am I not of her blood?
Tillyvally. Lady!
[Sings]
'There dwelt a man in Babylon, lady, lady!'",159,18711
631174,791,"Beshrew me, the knight's in admirable fooling.",401,18711
631175,792,"Ay, he does well enough if he be disposed, and so do
I too: he does it with a better grace, but I do it
more natural.",60,18711
631176,795,"[Sings] 'O, the twelfth day of December,'--",159,18711
631177,796,"For the love o' God, peace!",738,18711
631178,797,"[Enter MALVOLIO]",1261,18711
631179,798,"My masters, are you mad? or what are you? Have ye
no wit, manners, nor honesty, but to gabble like
tinkers at this time of night? Do ye make an
alehouse of my lady's house, that ye squeak out your
coziers' catches without any mitigation or remorse
of voice? Is there no respect of place, persons, nor
time in you?",728,18711
631180,805,"We did keep time, sir, in our catches. Sneck up!",159,18711
631181,806,"Sir Toby, I must be round with you. My lady bade me
tell you, that, though she harbours you as her
kinsman, she's nothing allied to your disorders. If
you can separate yourself and your misdemeanors, you
are welcome to the house; if not, an it would please
you to take leave of her, she is very willing to bid
you farewell.",728,18711
631182,813,"'Farewell, dear heart, since I must needs be gone.'",159,18711
631183,814,"Nay, good Sir Toby.",738,18711
631184,815,"'His eyes do show his days are almost done.'",401,18711
631185,816,"Is't even so?",728,18711
631186,817,"'But I will never die.'",159,18711
631187,818,"Sir Toby, there you lie.",401,18711
631188,819,"This is much credit to you.",728,18711
631189,820,"'Shall I bid him go?'",159,18711
631190,821,"'What an if you do?'",401,18711
631191,822,"'Shall I bid him go, and spare not?'",159,18711
631192,823,"'O no, no, no, no, you dare not.'",401,18711
631193,824,"Out o' tune, sir: ye lie. Art any more than a
steward? Dost thou think, because thou art
virtuous, there shall be no more cakes and ale?",159,18711
631194,827,"Yes, by Saint Anne, and ginger shall be hot i' the
mouth too.",401,18711
631195,829,"Thou'rt i' the right. Go, sir, rub your chain with
crumbs. A stoup of wine, Maria!",159,18711
631196,831,"Mistress Mary, if you prized my lady's favour at any
thing more than contempt, you would not give means
for this uncivil rule: she shall know of it, by this hand.",728,18711
631197,834,[Exit],1261,18711
631198,835,"Go shake your ears.",738,18711
631199,836,"'Twere as good a deed as to drink when a man's
a-hungry, to challenge him the field, and then to
break promise with him and make a fool of him.",60,18711
631200,839,"Do't, knight: I'll write thee a challenge: or I'll
deliver thy indignation to him by word of mouth.",159,18711
631201,841,"Sweet Sir Toby, be patient for tonight: since the
youth of the count's was today with thy lady, she is
much out of quiet. For Monsieur Malvolio, let me
alone with him: if I do not gull him into a
nayword, and make him a common recreation, do not
think I have wit enough to lie straight in my bed:
I know I can do it.",738,18711
631202,848,"Possess us, possess us; tell us something of him.",159,18711
631203,849,"Marry, sir, sometimes he is a kind of puritan.",738,18711
631204,850,"O, if I thought that I'ld beat him like a dog!",60,18711
631205,851,"What, for being a puritan? thy exquisite reason,
dear knight?",159,18711
631206,853,"I have no exquisite reason for't, but I have reason
good enough.",60,18711
631207,855,"The devil a puritan that he is, or any thing
constantly, but a time-pleaser; an affectioned ass,
that cons state without book and utters it by great
swarths: the best persuaded of himself, so
crammed, as he thinks, with excellencies, that it is
his grounds of faith that all that look on him love
him; and on that vice in him will my revenge find
notable cause to work.",738,18711
631208,863,"What wilt thou do?",159,18711
631209,864,"I will drop in his way some obscure epistles of
love; wherein, by the colour of his beard, the shape
of his leg, the manner of his gait, the expressure
of his eye, forehead, and complexion, he shall find
himself most feelingly personated. I can write very
like my lady your niece: on a forgotten matter we
can hardly make distinction of our hands.",738,18711
631210,871,"Excellent! I smell a device.",159,18711
631211,872,"I have't in my nose too.",60,18711
631212,873,"He shall think, by the letters that thou wilt drop,
that they come from my niece, and that she's in
love with him.",159,18711
631213,876,"My purpose is, indeed, a horse of that colour.",738,18711
631214,877,"And your horse now would make him an ass.",60,18711
631215,878,"Ass, I doubt not.",738,18711
631216,879,"O, 'twill be admirable!",60,18711
631217,880,"Sport royal, I warrant you: I know my physic will
work with him. I will plant you two, and let the
fool make a third, where he shall find the letter:
observe his construction of it. For this night, to
bed, and dream on the event. Farewell.",738,18711
631218,885,[Exit],1261,18711
631219,886,"Good night, Penthesilea.",159,18711
631220,887,"Before me, she's a good wench.",60,18711
631221,888,"She's a beagle, true-bred, and one that adores me:
what o' that?",159,18711
631222,890,"I was adored once too.",60,18711
631223,891,"Let's to bed, knight. Thou hadst need send for
more money.",159,18711
631224,893,"If I cannot recover your niece, I am a foul way out.",60,18711
631225,894,"Send for money, knight: if thou hast her not i'
the end, call me cut.",159,18711
631226,896,"If I do not, never trust me, take it how you will.",60,18711
631227,897,"Come, come, I'll go burn some sack; 'tis too late
to go to bed now: come, knight; come, knight.",159,18711
631228,899,[Exeunt],1261,18711
631229,901,"[Enter DUKE ORSINO, VIOLA, CURIO, and others]",1261,18712
631230,902,"Give me some music. Now, good morrow, friends.
Now, good Cesario, but that piece of song,
That old and antique song we heard last night:
Methought it did relieve my passion much,
More than light airs and recollected terms
Of these most brisk and giddy-paced times:
Come, but one verse.",840,18712
631231,909,"He is not here, so please your lordship that should sing it.",297,18712
631232,910,"Who was it?",840,18712
631233,911,"Feste, the jester, my lord; a fool that the lady
Olivia's father took much delight in. He is about the house.",297,18712
631234,913,"Seek him out, and play the tune the while.
[Exit CURIO. Music plays]
Come hither, boy: if ever thou shalt love,
In the sweet pangs of it remember me;
For such as I am all true lovers are,
Unstaid and skittish in all motions else,
Save in the constant image of the creature
That is beloved. How dost thou like this tune?",840,18712
631235,921,"It gives a very echo to the seat
Where Love is throned.",1238,18712
631236,923,"Thou dost speak masterly:
My life upon't, young though thou art, thine eye
Hath stay'd upon some favour that it loves:
Hath it not, boy?",840,18712
631237,927,"A little, by your favour.",1238,18712
631238,928,"What kind of woman is't?",840,18712
631239,929,"Of your complexion.",1238,18712
631240,930,"She is not worth thee, then. What years, i' faith?",840,18712
631241,931,"About your years, my lord.",1238,18712
631242,932,"Too old by heaven: let still the woman take
An elder than herself: so wears she to him,
So sways she level in her husband's heart:
For, boy, however we do praise ourselves,
Our fancies are more giddy and unfirm,
More longing, wavering, sooner lost and worn,
Than women's are.",840,18712
631243,939,"I think it well, my lord.",1238,18712
631244,940,"Then let thy love be younger than thyself,
Or thy affection cannot hold the bent;
For women are as roses, whose fair flower
Being once display'd, doth fall that very hour.",840,18712
631245,944,"And so they are: alas, that they are so;
To die, even when they to perfection grow!",1238,18712
631246,946,"[Re-enter CURIO and Clown]",1261,18712
631247,947,"O, fellow, come, the song we had last night.
Mark it, Cesario, it is old and plain;
The spinsters and the knitters in the sun
And the free maids that weave their thread with bones
Do use to chant it: it is silly sooth,
And dallies with the innocence of love,
Like the old age.",840,18712
631248,954,"Are you ready, sir?",401,18712
631249,955,"Ay; prithee, sing.
[Music]
SONG.",840,18712
631250,958,"Come away, come away, death,
And in sad cypress let me be laid;
Fly away, fly away breath;
I am slain by a fair cruel maid.
My shroud of white, stuck all with yew,
O, prepare it!
My part of death, no one so true
Did share it.
Not a flower, not a flower sweet
On my black coffin let there be strown;
Not a friend, not a friend greet
My poor corpse, where my bones shall be thrown:
A thousand thousand sighs to save,
Lay me, O, where
Sad true lover never find my grave,
To weep there!",401,18712
631251,974,"There's for thy pains.",840,18712
631252,975,"No pains, sir: I take pleasure in singing, sir.",401,18712
631253,976,"I'll pay thy pleasure then.",840,18712
631254,977,"Truly, sir, and pleasure will be paid, one time or another.",401,18712
631255,978,"Give me now leave to leave thee.",840,18712
631256,979,"Now, the melancholy god protect thee; and the
tailor make thy doublet of changeable taffeta, for
thy mind is a very opal. I would have men of such
constancy put to sea, that their business might be
every thing and their intent every where; for that's
it that always makes a good voyage of nothing. Farewell.",401,18712
631257,985,[Exit],1261,18712
631258,986,"Let all the rest give place.
[CURIO and Attendants retire]
Once more, Cesario,
Get thee to yond same sovereign cruelty:
Tell her, my love, more noble than the world,
Prizes not quantity of dirty lands;
The parts that fortune hath bestow'd upon her,
Tell her, I hold as giddily as fortune;
But 'tis that miracle and queen of gems
That nature pranks her in attracts my soul.",840,18712
631259,996,"But if she cannot love you, sir?",1238,18712
631260,997,"I cannot be so answer'd.",840,18712
631261,998,"Sooth, but you must.
Say that some lady, as perhaps there is,
Hath for your love a great a pang of heart
As you have for Olivia: you cannot love her;
You tell her so; must she not then be answer'd?",1238,18712
631262,1003,"There is no woman's sides
Can bide the beating of so strong a passion
As love doth give my heart; no woman's heart
So big, to hold so much; they lack retention
Alas, their love may be call'd appetite,
No motion of the liver, but the palate,
That suffer surfeit, cloyment and revolt;
But mine is all as hungry as the sea,
And can digest as much: make no compare
Between that love a woman can bear me
And that I owe Olivia.",840,18712
631263,1014,"Ay, but I know--",1238,18712
631264,1015,"What dost thou know?",840,18712
631265,1016,"Too well what love women to men may owe:
In faith, they are as true of heart as we.
My father had a daughter loved a man,
As it might be, perhaps, were I a woman,
I should your lordship.",1238,18712
631266,1021,"And what's her history?",840,18712
631267,1022,"A blank, my lord. She never told her love,
But let concealment, like a worm i' the bud,
Feed on her damask cheek: she pined in thought,
And with a green and yellow melancholy
She sat like patience on a monument,
Smiling at grief. Was not this love indeed?
We men may say more, swear more: but indeed
Our shows are more than will; for still we prove
Much in our vows, but little in our love.",1238,18712
631268,1031,"But died thy sister of her love, my boy?",840,18712
631269,1032,"I am all the daughters of my father's house,
And all the brothers too: and yet I know not.
Sir, shall I to this lady?",1238,18712
631270,1035,"Ay, that's the theme.
To her in haste; give her this jewel; say,
My love can give no place, bide no denay.",840,18712
631271,1038,[Exeunt],1261,18712
631272,1040,"[Enter SIR TOBY BELCH, SIR ANDREW, and FABIAN]",1261,18713
631273,1041,"Come thy ways, Signior Fabian.",159,18713
631274,1042,"Nay, I'll come: if I lose a scruple of this sport,
let me be boiled to death with melancholy.",391,18713
631275,1044,"Wouldst thou not be glad to have the niggardly
rascally sheep-biter come by some notable shame?",159,18713
631276,1046,"I would exult, man: you know, he brought me out o'
favour with my lady about a bear-baiting here.",391,18713
631277,1048,"To anger him we'll have the bear again; and we will
fool him black and blue: shall we not, Sir Andrew?",159,18713
631278,1050,"An we do not, it is pity of our lives.",60,18713
631279,1051,"Here comes the little villain.
[Enter MARIA]
How now, my metal of India!",159,18713
631280,1054,"Get ye all three into the box-tree: Malvolio's
coming down this walk: he has been yonder i' the
sun practising behavior to his own shadow this half
hour: observe him, for the love of mockery; for I
know this letter will make a contemplative idiot of
him. Close, in the name of jesting! Lie thou there,
[Throws down a letter]
for here comes the trout that must be caught with tickling.",738,18713
631281,1062,[Exit],1261,18713
631282,1063,"[Enter MALVOLIO]",1261,18713
631283,1064,"'Tis but fortune; all is fortune. Maria once told
me she did affect me: and I have heard herself come
thus near, that, should she fancy, it should be one
of my complexion. Besides, she uses me with a more
exalted respect than any one else that follows her.
What should I think on't?",728,18713
631284,1070,"Here's an overweening rogue!",159,18713
631285,1071,"O, peace! Contemplation makes a rare turkey-cock
of him: how he jets under his advanced plumes!",391,18713
631286,1073,"'Slight, I could so beat the rogue!",60,18713
631287,1074,"Peace, I say.",159,18713
631288,1075,"To be Count Malvolio!",728,18713
631289,1076,"Ah, rogue!",159,18713
