id,ParagraphNum,PlainText,character_id,chapter_id
631290,1077,"Pistol him, pistol him.",60,18713
631291,1078,"Peace, peace!",159,18713
631292,1079,"There is example for't; the lady of the Strachy
married the yeoman of the wardrobe.",728,18713
631293,1081,"Fie on him, Jezebel!",60,18713
631294,1082,"O, peace! now he's deeply in: look how
imagination blows him.",391,18713
631295,1084,"Having been three months married to her, sitting in
my state,--",728,18713
631296,1086,"O, for a stone-bow, to hit him in the eye!",159,18713
631297,1087,"Calling my officers about me, in my branched velvet
gown; having come from a day-bed, where I have left
Olivia sleeping,--",728,18713
631298,1090,"Fire and brimstone!",159,18713
631299,1091,"O, peace, peace!",391,18713
631300,1092,"And then to have the humour of state; and after a
demure travel of regard, telling them I know my
place as I would they should do theirs, to for my
kinsman Toby,--",728,18713
631301,1096,"Bolts and shackles!",159,18713
631302,1097,"O peace, peace, peace! now, now.",391,18713
631303,1098,"Seven of my people, with an obedient start, make
out for him: I frown the while; and perchance wind
up watch, or play with my--some rich jewel. Toby
approaches; courtesies there to me,--",728,18713
631304,1102,"Shall this fellow live?",159,18713
631305,1103,"Though our silence be drawn from us with cars, yet peace.",391,18713
631306,1104,"I extend my hand to him thus, quenching my familiar
smile with an austere regard of control,--",728,18713
631307,1106,"And does not Toby take you a blow o' the lips then?",159,18713
631308,1107,"Saying, 'Cousin Toby, my fortunes having cast me on
your niece give me this prerogative of speech,'--",728,18713
631309,1109,"What, what?",159,18713
631310,1110,"'You must amend your drunkenness.'",728,18713
631311,1111,"Out, scab!",159,18713
631312,1112,"Nay, patience, or we break the sinews of our plot.",391,18713
631313,1113,"'Besides, you waste the treasure of your time with
a foolish knight,'--",728,18713
631314,1115,"That's me, I warrant you.",60,18713
631315,1116,"'One Sir Andrew,'--",728,18713
631316,1117,"I knew 'twas I; for many do call me fool.",60,18713
631317,1118,"What employment have we here?",728,18713
631318,1119,"[Taking up the letter]",1261,18713
631319,1120,"Now is the woodcock near the gin.",391,18713
631320,1121,"O, peace! and the spirit of humour intimate reading
aloud to him!",159,18713
631321,1123,"By my life, this is my lady's hand these be her
very C's, her U's and her T's and thus makes she her
great P's. It is, in contempt of question, her hand.",728,18713
631322,1126,"Her C's, her U's and her T's: why that?",60,18713
631323,1127,"[Reads] 'To the unknown beloved, this, and my good
wishes:'--her very phrases! By your leave, wax.
Soft! and the impressure her Lucrece, with which she
uses to seal: 'tis my lady. To whom should this be?",728,18713
631324,1131,"This wins him, liver and all.",391,18713
631325,1132,"[Reads]
Jove knows I love: But who?
Lips, do not move;
No man must know.
'No man must know.' What follows? the numbers
altered! 'No man must know:' if this should be
thee, Malvolio?",728,18713
631326,1139,"Marry, hang thee, brock!",159,18713
631327,1140,"[Reads]
I may command where I adore;
But silence, like a Lucrece knife,
With bloodless stroke my heart doth gore:
M, O, A, I, doth sway my life.",728,18713
631328,1145,"A fustian riddle!",391,18713
631329,1146,"Excellent wench, say I.",159,18713
631330,1147,"'M, O, A, I, doth sway my life.' Nay, but first, let
me see, let me see, let me see.",728,18713
631331,1149,"What dish o' poison has she dressed him!",391,18713
631332,1150,"And with what wing the staniel cheques at it!",159,18713
631333,1151,"'I may command where I adore.' Why, she may command
me: I serve her; she is my lady. Why, this is
evident to any formal capacity; there is no
obstruction in this: and the end,--what should
that alphabetical position portend? If I could make
that resemble something in me,--Softly! M, O, A,
I,--",728,18713
631334,1158,"O, ay, make up that: he is now at a cold scent.",159,18713
631335,1159,"Sowter will cry upon't for all this, though it be as
rank as a fox.",391,18713
631336,1161,"M,--Malvolio; M,--why, that begins my name.",728,18713
631337,1162,"Did not I say he would work it out? the cur is
excellent at faults.",391,18713
631338,1164,"M,--but then there is no consonancy in the sequel;
that suffers under probation A should follow but O does.",728,18713
631339,1166,"And O shall end, I hope.",391,18713
631340,1167,"Ay, or I'll cudgel him, and make him cry O!",159,18713
631341,1168,"And then I comes behind.",728,18713
631342,1169,"Ay, an you had any eye behind you, you might see
more detraction at your heels than fortunes before
you.",391,18713
631343,1172,"M, O, A, I; this simulation is not as the former: and
yet, to crush this a little, it would bow to me, for
every one of these letters are in my name. Soft!
here follows prose.
[Reads]
'If this fall into thy hand, revolve. In my stars I
am above thee; but be not afraid of greatness: some
are born great, some achieve greatness, and some
have greatness thrust upon 'em. Thy Fates open
their hands; let thy blood and spirit embrace them;
and, to inure thyself to what thou art like to be,
cast thy humble slough and appear fresh. Be
opposite with a kinsman, surly with servants; let
thy tongue tang arguments of state; put thyself into
the trick of singularity: she thus advises thee
that sighs for thee. Remember who commended thy
yellow stockings, and wished to see thee ever
cross-gartered: I say, remember. Go to, thou art
made, if thou desirest to be so; if not, let me see
thee a steward still, the fellow of servants, and
not worthy to touch Fortune's fingers. Farewell.
She that would alter services with thee,
THE FORTUNATE-UNHAPPY.'
Daylight and champaign discovers not more: this is
open. I will be proud, I will read politic authors,
I will baffle Sir Toby, I will wash off gross
acquaintance, I will be point-devise the very man.
I do not now fool myself, to let imagination jade
me; for every reason excites to this, that my lady
loves me. She did commend my yellow stockings of
late, she did praise my leg being cross-gartered;
and in this she manifests herself to my love, and
with a kind of injunction drives me to these habits
of her liking. I thank my stars I am happy. I will
be strange, stout, in yellow stockings, and
cross-gartered, even with the swiftness of putting
on. Jove and my stars be praised! Here is yet a
postscript.
[Reads]
'Thou canst not choose but know who I am. If thou
entertainest my love, let it appear in thy smiling;
thy smiles become thee well; therefore in my
presence still smile, dear my sweet, I prithee.'
Jove, I thank thee: I will smile; I will do
everything that thou wilt have me.",728,18713
631344,1217,[Exit],1261,18713
631345,1218,"I will not give my part of this sport for a pension
of thousands to be paid from the Sophy.",391,18713
631346,1220,"I could marry this wench for this device.",159,18713
631347,1221,"So could I too.",60,18713
631348,1222,"And ask no other dowry with her but such another jest.",159,18713
631349,1223,"Nor I neither.",60,18713
631350,1224,"Here comes my noble gull-catcher.",391,18713
631351,1225,"[Re-enter MARIA]",1261,18713
631352,1226,"Wilt thou set thy foot o' my neck?",159,18713
631353,1227,"Or o' mine either?",60,18713
631354,1228,"Shall I play my freedom at traytrip, and become thy
bond-slave?",159,18713
631355,1230,"I' faith, or I either?",60,18713
631356,1231,"Why, thou hast put him in such a dream, that when
the image of it leaves him he must run mad.",159,18713
631357,1233,"Nay, but say true; does it work upon him?",738,18713
631358,1234,"Like aqua-vitae with a midwife.",159,18713
631359,1235,"If you will then see the fruits of the sport, mark
his first approach before my lady: he will come to
her in yellow stockings, and 'tis a colour she
abhors, and cross-gartered, a fashion she detests;
and he will smile upon her, which will now be so
unsuitable to her disposition, being addicted to a
melancholy as she is, that it cannot but turn him
into a notable contempt. If you will see it, follow
me.",738,18713
631360,1244,"To the gates of Tartar, thou most excellent devil of wit!",159,18713
631361,1245,"I'll make one too.",60,18713
631362,1246,[Exeunt],1261,18713
631363,1249,"[Enter VIOLA, and Clown with a tabour]",1261,18714
631364,1250,"Save thee, friend, and thy music: dost thou live by
thy tabour?",1238,18714
631365,1252,"No, sir, I live by the church.",401,18714
631366,1253,"Art thou a churchman?",1238,18714
631367,1254,"No such matter, sir: I do live by the church; for
I do live at my house, and my house doth stand by
the church.",401,18714
631368,1257,"So thou mayst say, the king lies by a beggar, if a
beggar dwell near him; or, the church stands by thy
tabour, if thy tabour stand by the church.",1238,18714
631369,1260,"You have said, sir. To see this age! A sentence is
but a cheveril glove to a good wit: how quickly the
wrong side may be turned outward!",401,18714
631370,1263,"Nay, that's certain; they that dally nicely with
words may quickly make them wanton.",1238,18714
631371,1265,"I would, therefore, my sister had had no name, sir.",401,18714
631372,1266,"Why, man?",1238,18714
631373,1267,"Why, sir, her name's a word; and to dally with that
word might make my sister wanton. But indeed words
are very rascals since bonds disgraced them.",401,18714
631374,1270,"Thy reason, man?",1238,18714
631375,1271,"Troth, sir, I can yield you none without words; and
words are grown so false, I am loath to prove
reason with them.",401,18714
631376,1274,"I warrant thou art a merry fellow and carest for nothing.",1238,18714
631377,1275,"Not so, sir, I do care for something; but in my
conscience, sir, I do not care for you: if that be
to care for nothing, sir, I would it would make you invisible.",401,18714
631378,1278,"Art not thou the Lady Olivia's fool?",1238,18714
631379,1279,"No, indeed, sir; the Lady Olivia has no folly: she
will keep no fool, sir, till she be married; and
fools are as like husbands as pilchards are to
herrings; the husband's the bigger: I am indeed not
her fool, but her corrupter of words.",401,18714
631380,1284,"I saw thee late at the Count Orsino's.",1238,18714
631381,1285,"Foolery, sir, does walk about the orb like the sun,
it shines every where. I would be sorry, sir, but
the fool should be as oft with your master as with
my mistress: I think I saw your wisdom there.",401,18714
631382,1289,"Nay, an thou pass upon me, I'll no more with thee.
Hold, there's expenses for thee.",1238,18714
631383,1291,"Now Jove, in his next commodity of hair, send thee a beard!",401,18714
631384,1292,"By my troth, I'll tell thee, I am almost sick for
one;
[Aside]
though I would not have it grow on my chin. Is thy
lady within?",1238,18714
631385,1297,"Would not a pair of these have bred, sir?",401,18714
631386,1298,"Yes, being kept together and put to use.",1238,18714
631387,1299,"I would play Lord Pandarus of Phrygia, sir, to bring
a Cressida to this Troilus.",401,18714
631388,1301,"I understand you, sir; 'tis well begged.",1238,18714
631389,1302,"The matter, I hope, is not great, sir, begging but
a beggar: Cressida was a beggar. My lady is
within, sir. I will construe to them whence you
come; who you are and what you would are out of my
welkin, I might say 'element,' but the word is over-worn.",401,18714
631390,1307,[Exit],1261,18714
631391,1308,"This fellow is wise enough to play the fool;
And to do that well craves a kind of wit:
He must observe their mood on whom he jests,
The quality of persons, and the time,
And, like the haggard, cheque at every feather
That comes before his eye. This is a practise
As full of labour as a wise man's art
For folly that he wisely shows is fit;
But wise men, folly-fall'n, quite taint their wit.",1238,18714
631392,1317,"[Enter SIR TOBY BELCH, and SIR ANDREW]",1261,18714
631393,1318,"Save you, gentleman.",159,18714
631394,1319,"And you, sir.",1238,18714
631395,1320,"Dieu vous garde, monsieur.",60,18714
631396,1321,"Et vous aussi; votre serviteur.",1238,18714
631397,1322,"I hope, sir, you are; and I am yours.",60,18714
631398,1323,"Will you encounter the house? my niece is desirous
you should enter, if your trade be to her.",159,18714
631399,1325,"I am bound to your niece, sir; I mean, she is the
list of my voyage.",1238,18714
631400,1327,"Taste your legs, sir; put them to motion.",159,18714
631401,1328,"My legs do better understand me, sir, than I
understand what you mean by bidding me taste my legs.",1238,18714
631402,1330,"I mean, to go, sir, to enter.",159,18714
631403,1331,"I will answer you with gait and entrance. But we
are prevented.
[Enter OLIVIA and MARIA]
Most excellent accomplished lady, the heavens rain
odours on you!",1238,18714
631404,1336,"That youth's a rare courtier: 'Rain odours;' well.",60,18714
631405,1337,"My matter hath no voice, to your own most pregnant
and vouchsafed ear.",1238,18714
631406,1339,"'Odours,' 'pregnant' and 'vouchsafed:' I'll get 'em
all three all ready.",60,18714
631407,1341,"Let the garden door be shut, and leave me to my hearing.
[Exeunt SIR TOBY BELCH, SIR ANDREW, and MARIA]
Give me your hand, sir.",836,18714
631408,1344,"My duty, madam, and most humble service.",1238,18714
631409,1345,"What is your name?",836,18714
631410,1346,"Cesario is your servant's name, fair princess.",1238,18714
631411,1347,"My servant, sir! 'Twas never merry world
Since lowly feigning was call'd compliment:
You're servant to the Count Orsino, youth.",836,18714
631412,1350,"And he is yours, and his must needs be yours:
Your servant's servant is your servant, madam.",1238,18714
631413,1352,"For him, I think not on him: for his thoughts,
Would they were blanks, rather than fill'd with me!",836,18714
631414,1354,"Madam, I come to whet your gentle thoughts
On his behalf.",1238,18714
631415,1356,"O, by your leave, I pray you,
I bade you never speak again of him:
But, would you undertake another suit,
I had rather hear you to solicit that
Than music from the spheres.",836,18714
631416,1361,"Dear lady,--",1238,18714
631417,1362,"Give me leave, beseech you. I did send,
After the last enchantment you did here,
A ring in chase of you: so did I abuse
Myself, my servant and, I fear me, you:
Under your hard construction must I sit,To force that on you, in a shameful cunning,
Which you knew none of yours: what might you think?
Have you not set mine honour at the stake
And baited it with all the unmuzzled thoughts
That tyrannous heart can think? To one of your receiving
Enough is shown: a cypress, not a bosom,
Hideth my heart. So, let me hear you speak.",836,18714
631418,1373,"I pity you.",1238,18714
631419,1374,"That's a degree to love.",836,18714
631420,1375,"No, not a grize; for 'tis a vulgar proof,
That very oft we pity enemies.",1238,18714
631421,1377,"Why, then, methinks 'tis time to smile again.
O, world, how apt the poor are to be proud!
If one should be a prey, how much the better
To fall before the lion than the wolf!
[Clock strikes]
The clock upbraids me with the waste of time.
Be not afraid, good youth, I will not have you:
And yet, when wit and youth is come to harvest,
Your were is alike to reap a proper man:
There lies your way, due west.",836,18714
631422,1387,"Then westward-ho! Grace and good disposition
Attend your ladyship!
You'll nothing, madam, to my lord by me?",1238,18714
631423,1390,"Stay:
I prithee, tell me what thou thinkest of me.",836,18714
631424,1392,"That you do think you are not what you are.",1238,18714
631425,1393,"If I think so, I think the same of you.",836,18714
631426,1394,"Then think you right: I am not what I am.",1238,18714
631427,1395,"I would you were as I would have you be!",836,18714
631428,1396,"Would it be better, madam, than I am?
I wish it might, for now I am your fool.",1238,18714
631429,1398,"O, what a deal of scorn looks beautiful
In the contempt and anger of his lip!
A murderous guilt shows not itself more soon
Than love that would seem hid: love's night is noon.
Cesario, by the roses of the spring,
By maidhood, honour, truth and every thing,
I love thee so, that, maugre all thy pride,
Nor wit nor reason can my passion hide.
Do not extort thy reasons from this clause,
For that I woo, thou therefore hast no cause,
But rather reason thus with reason fetter,
Love sought is good, but given unsought better.",836,18714
631430,1410,"By innocence I swear, and by my youth
I have one heart, one bosom and one truth,
And that no woman has; nor never none
Shall mistress be of it, save I alone.
And so adieu, good madam: never more
Will I my master's tears to you deplore.",1238,18714
631431,1416,"Yet come again; for thou perhaps mayst move
That heart, which now abhors, to like his love.",836,18714
631432,1418,[Exeunt],1261,18714
631433,1420,"[Enter SIR TOBY BELCH, SIR ANDREW, and FABIAN]",1261,18715
631434,1421,"No, faith, I'll not stay a jot longer.",60,18715
631435,1422,"Thy reason, dear venom, give thy reason.",159,18715
631436,1423,"You must needs yield your reason, Sir Andrew.",391,18715
631437,1424,"Marry, I saw your niece do more favours to the
count's serving-man than ever she bestowed upon me;
I saw't i' the orchard.",60,18715
631438,1427,"Did she see thee the while, old boy? tell me that.",159,18715
631439,1428,"As plain as I see you now.",60,18715
631440,1429,"This was a great argument of love in her toward you.",391,18715
631441,1430,"'Slight, will you make an ass o' me?",60,18715
631442,1431,"I will prove it legitimate, sir, upon the oaths of
judgment and reason.",391,18715
631443,1433,"And they have been grand-jury-men since before Noah
was a sailor.",159,18715
631444,1435,"She did show favour to the youth in your sight only
to exasperate you, to awake your dormouse valour, to
put fire in your heart and brimstone in your liver.
You should then have accosted her; and with some
excellent jests, fire-new from the mint, you should
have banged the youth into dumbness. This was
looked for at your hand, and this was balked: the
double gilt of this opportunity you let time wash
off, and you are now sailed into the north of my
lady's opinion; where you will hang like an icicle
on a Dutchman's beard, unless you do redeem it by
some laudable attempt either of valour or policy.",391,18715
631445,1447,"An't be any way, it must be with valour; for policy
I hate: I had as lief be a Brownist as a
politician.",60,18715
631446,1450,"Why, then, build me thy fortunes upon the basis of
valour. Challenge me the count's youth to fight
with him; hurt him in eleven places: my niece shall
take note of it; and assure thyself, there is no
love-broker in the world can more prevail in man's
commendation with woman than report of valour.",159,18715
631447,1456,"There is no way but this, Sir Andrew.",391,18715
631448,1457,"Will either of you bear me a challenge to him?",60,18715
631449,1458,"Go, write it in a martial hand; be curst and brief;
it is no matter how witty, so it be eloquent and fun
of invention: taunt him with the licence of ink:
if thou thou'st him some thrice, it shall not be
amiss; and as many lies as will lie in thy sheet of
paper, although the sheet were big enough for the
bed of Ware in England, set 'em down: go, about it.
Let there be gall enough in thy ink, though thou
write with a goose-pen, no matter: about it.",159,18715
631450,1467,"Where shall I find you?",60,18715
631451,1468,"We'll call thee at the cubiculo: go.",159,18715
631452,1469,"[Exit SIR ANDREW]",1261,18715
631453,1470,"This is a dear manikin to you, Sir Toby.",391,18715
631454,1471,"I have been dear to him, lad, some two thousand
strong, or so.",159,18715
631455,1473,"We shall have a rare letter from him: but you'll
not deliver't?",391,18715
631456,1475,"Never trust me, then; and by all means stir on the
youth to an answer. I think oxen and wainropes
cannot hale them together. For Andrew, if he were
opened, and you find so much blood in his liver as
will clog the foot of a flea, I'll eat the rest of
the anatomy.",159,18715
631457,1481,"And his opposite, the youth, bears in his visage no
great presage of cruelty.",391,18715
631458,1483,"[Enter MARIA]",1261,18715
631459,1484,"Look, where the youngest wren of nine comes.",159,18715
631460,1485,"If you desire the spleen, and will laugh yourself
into stitches, follow me. Yond gull Malvolio is
turned heathen, a very renegado; for there is no
Christian, that means to be saved by believing
rightly, can ever believe such impossible passages
of grossness. He's in yellow stockings.",738,18715
631461,1491,"And cross-gartered?",159,18715
631462,1492,"Most villanously; like a pedant that keeps a school
i' the church. I have dogged him, like his
murderer. He does obey every point of the letter
that I dropped to betray him: he does smile his
face into more lines than is in the new map with the
augmentation of the Indies: you have not seen such
a thing as 'tis. I can hardly forbear hurling things
at him. I know my lady will strike him: if she do,
he'll smile and take't for a great favour.",738,18715
631463,1501,"Come, bring us, bring us where he is.",159,18715
631464,1502,[Exeunt],1261,18715
631465,1504,"[Enter SEBASTIAN and ANTONIO]",1261,18716
631466,1505,"I would not by my will have troubled you;
But, since you make your pleasure of your pains,
I will no further chide you.",976,18716
631467,1508,"I could not stay behind you: my desire,
More sharp than filed steel, did spur me forth;
And not all love to see you, though so much
As might have drawn one to a longer voyage,
But jealousy what might befall your travel,
Being skilless in these parts; which to a stranger,
Unguided and unfriended, often prove
Rough and unhospitable: my willing love,
The rather by these arguments of fear,
Set forth in your pursuit.",116,18716
631468,1518,"My kind Antonio,
I can no other answer make but thanks,
And thanks; and ever thanks; and oft good turns
Are shuffled off with such uncurrent pay:
But, were my worth as is my conscience firm,
You should find better dealing. What's to do?
Shall we go see the reliques of this town?",976,18716
631469,1525,"To-morrow, sir: best first go see your lodging.",116,18716
631470,1526,"I am not weary, and 'tis long to night:
I pray you, let us satisfy our eyes
With the memorials and the things of fame
That do renown this city.",976,18716
631471,1530,"Would you'ld pardon me;
I do not without danger walk these streets:
Once, in a sea-fight, 'gainst the count his galleys
I did some service; of such note indeed,
That were I ta'en here it would scarce be answer'd.",116,18716
631472,1535,"Belike you slew great number of his people.",976,18716
631473,1536,"The offence is not of such a bloody nature;
Albeit the quality of the time and quarrel
Might well have given us bloody argument.
It might have since been answer'd in repaying
What we took from them; which, for traffic's sake,
Most of our city did: only myself stood out;
For which, if I be lapsed in this place,
I shall pay dear.",116,18716
631474,1544,"Do not then walk too open.",976,18716
631475,1545,"It doth not fit me. Hold, sir, here's my purse.
In the south suburbs, at the Elephant,
Is best to lodge: I will bespeak our diet,
Whiles you beguile the time and feed your knowledge
With viewing of the town: there shall you have me.",116,18716
631476,1550,"Why I your purse?",976,18716
631477,1551,"Haply your eye shall light upon some toy
You have desire to purchase; and your store,
I think, is not for idle markets, sir.",116,18716
631478,1554,"I'll be your purse-bearer and leave you
For an hour.",976,18716
631479,1556,"To the Elephant.",116,18716
631480,1557,"I do remember.",976,18716
631481,1558,[Exeunt],1261,18716
631482,1560,"[Enter OLIVIA and MARIA]",1261,18717
631483,1561,"I have sent after him: he says he'll come;
How shall I feast him? what bestow of him?
For youth is bought more oft than begg'd or borrow'd.
I speak too loud.
Where is Malvolio? he is sad and civil,
And suits well for a servant with my fortunes:
Where is Malvolio?",836,18717
631484,1568,"He's coming, madam; but in very strange manner. He
is, sure, possessed, madam.",738,18717
631485,1570,"Why, what's the matter? does he rave?",836,18717
631486,1571,"No. madam, he does nothing but smile: your
ladyship were best to have some guard about you, if
he come; for, sure, the man is tainted in's wits.",738,18717
631487,1574,"Go call him hither.
[Exit MARIA]
I am as mad as he,
If sad and merry madness equal be.
[Re-enter MARIA, with MALVOLIO]
How now, Malvolio!",836,18717
631488,1580,"Sweet lady, ho, ho.",728,18717
631489,1581,"Smilest thou?
I sent for thee upon a sad occasion.",836,18717
631490,1583,"Sad, lady! I could be sad: this does make some
obstruction in the blood, this cross-gartering; but
what of that? if it please the eye of one, it is
with me as the very true sonnet is, 'Please one, and
please all.'",728,18717
631491,1588,"Why, how dost thou, man? what is the matter with thee?",836,18717
631492,1589,"Not black in my mind, though yellow in my legs. It
did come to his hands, and commands shall be
executed: I think we do know the sweet Roman hand.",728,18717
631493,1592,"Wilt thou go to bed, Malvolio?",836,18717
631494,1593,"To bed! ay, sweet-heart, and I'll come to thee.",728,18717
631495,1594,"God comfort thee! Why dost thou smile so and kiss
thy hand so oft?",836,18717
631496,1596,"How do you, Malvolio?",738,18717
631497,1597,"At your request! yes; nightingales answer daws.",728,18717
631498,1598,"Why appear you with this ridiculous boldness before my lady?",738,18717
631499,1599,"'Be not afraid of greatness:' 'twas well writ.",728,18717
631500,1600,"What meanest thou by that, Malvolio?",836,18717
631501,1601,"'Some are born great,'--",728,18717
631502,1602,Ha!,836,18717
631503,1603,"'Some achieve greatness,'--",728,18717
631504,1604,"What sayest thou?",836,18717
631505,1605,"'And some have greatness thrust upon them.'",728,18717
